{
  "$schema": "http://json-schema.org/draft-07/schema#",
  "type": "object",
  "properties": {
    "$schema": {
      "type": "string"
    },
    "version": {
      "type": "number",
      "const": 1
    },
    "site": {
      "type": "object",
      "properties": {
        "baseUrl": {
          "type": "string",
          "format": "uri"
        },
        "title": {
          "type": "object",
          "properties": {
            "ru": {
              "type": "string",
              "minLength": 1
            },
            "en": {
              "type": "string",
              "minLength": 1
            }
          },
          "required": [
            "ru",
            "en"
          ],
          "additionalProperties": false
        },
        "description": {
          "type": "object",
          "properties": {
            "ru": {
              "type": "string",
              "minLength": 1
            },
            "en": {
              "type": "string",
              "minLength": 1
            }
          },
          "required": [
            "ru",
            "en"
          ],
          "additionalProperties": false
        }
      },
      "required": [
        "baseUrl",
        "title",
        "description"
      ],
      "additionalProperties": false
    },
    "profile": {
      "type": "object",
      "properties": {
        "name": {
          "type": "object",
          "properties": {
            "ru": {
              "type": "string",
              "minLength": 1
            },
            "en": {
              "type": "string",
              "minLength": 1
            }
          },
          "required": [
            "ru",
            "en"
          ],
          "additionalProperties": false
        },
        "role": {
          "type": "object",
          "properties": {
            "ru": {
              "type": "string",
              "minLength": 1
            },
            "en": {
              "type": "string",
              "minLength": 1
            }
          },
          "required": [
            "ru",
            "en"
          ],
          "additionalProperties": false
        },
        "intro": {
          "type": "object",
          "properties": {
            "ru": {
              "type": "string",
              "minLength": 1
            },
            "en": {
              "type": "string",
              "minLength": 1
            }
          },
          "required": [
            "ru",
            "en"
          ],
          "additionalProperties": false
        },
        "about": {
          "type": "object",
          "properties": {
            "ru": {
              "type": "string",
              "minLength": 1
            },
            "en": {
              "type": "string",
              "minLength": 1
            }
          },
          "required": [
            "ru",
            "en"
          ],
          "additionalProperties": false
        },
        "github": {
          "type": "string",
          "format": "uri"
        },
        "email": {
          "anyOf": [
            {
              "type": "string",
              "format": "email",
              "pattern": "^(?:[A-Za-z0-9_'+\\-]+\\.)*[A-Za-z0-9_'+\\-]*[A-Za-z0-9_+-]@(?:[A-Za-z0-9][A-Za-z0-9\\-]*\\.)+[A-Za-z]{2,}$"
            },
            {
              "type": "null"
            }
          ]
        },
        "telegram": {
          "anyOf": [
            {
              "type": "string",
              "format": "uri"
            },
            {
              "type": "null"
            }
          ]
        },
        "resume": {
          "anyOf": [
            {
              "type": "string",
              "format": "uri"
            },
            {
              "type": "null"
            }
          ]
        }
      },
      "required": [
        "name",
        "role",
        "intro",
        "about",
        "github",
        "email",
        "telegram",
        "resume"
      ],
      "additionalProperties": false
    },
    "copy": {
      "type": "object",
      "properties": {
        "ru": {
          "type": "object",
          "propertyNames": {
            "type": "string",
            "enum": [
              "skip",
              "navWork",
              "navAbout",
              "navContact",
              "navMenu",
              "navClose",
              "theme",
              "language",
              "home",
              "heroEyebrow",
              "heroLine1",
              "heroLine2",
              "heroLine3",
              "viewWork",
              "github",
              "scroll",
              "indexLabel",
              "workEyebrow",
              "workTitle",
              "workIntro",
              "caseStudy",
              "liveDemo",
              "source",
              "backend",
              "projectCount",
              "aboutEyebrow",
              "aboutTitle",
              "aboutNote",
              "skillsTitle",
              "skillsIntro",
              "relatedProjects",
              "contactEyebrow",
              "contactTitle",
              "contactIntro",
              "contactAction",
              "email",
              "telegram",
              "resume",
              "footerNote",
              "backTop",
              "print",
              "backWork",
              "overview",
              "features",
              "decisions",
              "stack",
              "links",
              "nextProject",
              "caseLabel",
              "notFoundTitle",
              "notFoundText",
              "experienceTitle",
              "allProjects"
            ]
          },
          "additionalProperties": {
            "type": "string",
            "minLength": 1
          },
          "required": [
            "skip",
            "navWork",
            "navAbout",
            "navContact",
            "navMenu",
            "navClose",
            "theme",
            "language",
            "home",
            "heroEyebrow",
            "heroLine1",
            "heroLine2",
            "heroLine3",
            "viewWork",
            "github",
            "scroll",
            "indexLabel",
            "workEyebrow",
            "workTitle",
            "workIntro",
            "caseStudy",
            "liveDemo",
            "source",
            "backend",
            "projectCount",
            "aboutEyebrow",
            "aboutTitle",
            "aboutNote",
            "skillsTitle",
            "skillsIntro",
            "relatedProjects",
            "contactEyebrow",
            "contactTitle",
            "contactIntro",
            "contactAction",
            "email",
            "telegram",
            "resume",
            "footerNote",
            "backTop",
            "print",
            "backWork",
            "overview",
            "features",
            "decisions",
            "stack",
            "links",
            "nextProject",
            "caseLabel",
            "notFoundTitle",
            "notFoundText",
            "experienceTitle",
            "allProjects"
          ]
        },
        "en": {
          "type": "object",
          "propertyNames": {
            "type": "string",
            "enum": [
              "skip",
              "navWork",
              "navAbout",
              "navContact",
              "navMenu",
              "navClose",
              "theme",
              "language",
              "home",
              "heroEyebrow",
              "heroLine1",
              "heroLine2",
              "heroLine3",
              "viewWork",
              "github",
              "scroll",
              "indexLabel",
              "workEyebrow",
              "workTitle",
              "workIntro",
              "caseStudy",
              "liveDemo",
              "source",
              "backend",
              "projectCount",
              "aboutEyebrow",
              "aboutTitle",
              "aboutNote",
              "skillsTitle",
              "skillsIntro",
              "relatedProjects",
              "contactEyebrow",
              "contactTitle",
              "contactIntro",
              "contactAction",
              "email",
              "telegram",
              "resume",
              "footerNote",
              "backTop",
              "print",
              "backWork",
              "overview",
              "features",
              "decisions",
              "stack",
              "links",
              "nextProject",
              "caseLabel",
              "notFoundTitle",
              "notFoundText",
              "experienceTitle",
              "allProjects"
            ]
          },
          "additionalProperties": {
            "type": "string",
            "minLength": 1
          },
          "required": [
            "skip",
            "navWork",
            "navAbout",
            "navContact",
            "navMenu",
            "navClose",
            "theme",
            "language",
            "home",
            "heroEyebrow",
            "heroLine1",
            "heroLine2",
            "heroLine3",
            "viewWork",
            "github",
            "scroll",
            "indexLabel",
            "workEyebrow",
            "workTitle",
            "workIntro",
            "caseStudy",
            "liveDemo",
            "source",
            "backend",
            "projectCount",
            "aboutEyebrow",
            "aboutTitle",
            "aboutNote",
            "skillsTitle",
            "skillsIntro",
            "relatedProjects",
            "contactEyebrow",
            "contactTitle",
            "contactIntro",
            "contactAction",
            "email",
            "telegram",
            "resume",
            "footerNote",
            "backTop",
            "print",
            "backWork",
            "overview",
            "features",
            "decisions",
            "stack",
            "links",
            "nextProject",
            "caseLabel",
            "notFoundTitle",
            "notFoundText",
            "experienceTitle",
            "allProjects"
          ]
        }
      },
      "required": [
        "ru",
        "en"
      ],
      "additionalProperties": false
    },
    "skills": {
      "type": "array",
      "items": {
        "type": "object",
        "properties": {
          "id": {
            "type": "string",
            "minLength": 1
          },
          "title": {
            "type": "object",
            "properties": {
              "ru": {
                "type": "string",
                "minLength": 1
              },
              "en": {
                "type": "string",
                "minLength": 1
              }
            },
            "required": [
              "ru",
              "en"
            ],
            "additionalProperties": false
          },
          "description": {
            "type": "object",
            "properties": {
              "ru": {
                "type": "string",
                "minLength": 1
              },
              "en": {
                "type": "string",
                "minLength": 1
              }
            },
            "required": [
              "ru",
              "en"
            ],
            "additionalProperties": false
          },
          "technologies": {
            "minItems": 1,
            "type": "array",
            "items": {
              "type": "string",
              "minLength": 1
            }
          },
          "projects": {
            "type": "array",
            "items": {
              "type": "string",
              "minLength": 1
            }
          }
        },
        "required": [
          "id",
          "title",
          "description",
          "technologies",
          "projects"
        ],
        "additionalProperties": false
      }
    },
    "experience": {
      "type": "array",
      "items": {
        "type": "object",
        "properties": {
          "company": {
            "type": "string",
            "minLength": 1
          },
          "role": {
            "type": "object",
            "properties": {
              "ru": {
                "type": "string",
                "minLength": 1
              },
              "en": {
                "type": "string",
                "minLength": 1
              }
            },
            "required": [
              "ru",
              "en"
            ],
            "additionalProperties": false
          },
          "period": {
            "type": "object",
            "properties": {
              "ru": {
                "type": "string",
                "minLength": 1
              },
              "en": {
                "type": "string",
                "minLength": 1
              }
            },
            "required": [
              "ru",
              "en"
            ],
            "additionalProperties": false
          },
          "description": {
            "type": "object",
            "properties": {
              "ru": {
                "type": "string",
                "minLength": 1
              },
              "en": {
                "type": "string",
                "minLength": 1
              }
            },
            "required": [
              "ru",
              "en"
            ],
            "additionalProperties": false
          }
        },
        "required": [
          "company",
          "role",
          "period",
          "description"
        ],
        "additionalProperties": false
      }
    },
    "projects": {
      "minItems": 1,
      "type": "array",
      "items": {
        "type": "object",
        "properties": {
          "slug": {
            "type": "string",
            "pattern": "^[a-z0-9]+(?:-[a-z0-9]+)*$"
          },
          "title": {
            "type": "string",
            "minLength": 1
          },
          "status": {
            "type": "string",
            "enum": [
              "draft",
              "published"
            ]
          },
          "order": {
            "type": "integer",
            "minimum": 0,
            "maximum": 9007199254740991
          },
          "featured": {
            "type": "boolean"
          },
          "category": {
            "type": "object",
            "properties": {
              "ru": {
                "type": "string",
                "minLength": 1
              },
              "en": {
                "type": "string",
                "minLength": 1
              }
            },
            "required": [
              "ru",
              "en"
            ],
            "additionalProperties": false
          },
          "summary": {
            "type": "object",
            "properties": {
              "ru": {
                "type": "string",
                "minLength": 1
              },
              "en": {
                "type": "string",
                "minLength": 1
              }
            },
            "required": [
              "ru",
              "en"
            ],
            "additionalProperties": false
          },
          "overview": {
            "type": "object",
            "properties": {
              "ru": {
                "type": "string",
                "minLength": 1
              },
              "en": {
                "type": "string",
                "minLength": 1
              }
            },
            "required": [
              "ru",
              "en"
            ],
            "additionalProperties": false
          },
          "features": {
            "type": "object",
            "properties": {
              "ru": {
                "type": "array",
                "items": {
                  "type": "string",
                  "minLength": 1
                }
              },
              "en": {
                "type": "array",
                "items": {
                  "type": "string",
                  "minLength": 1
                }
              }
            },
            "required": [
              "ru",
              "en"
            ],
            "additionalProperties": false
          },
          "decisions": {
            "type": "object",
            "properties": {
              "ru": {
                "type": "array",
                "items": {
                  "type": "string",
                  "minLength": 1
                }
              },
              "en": {
                "type": "array",
                "items": {
                  "type": "string",
                  "minLength": 1
                }
              }
            },
            "required": [
              "ru",
              "en"
            ],
            "additionalProperties": false
          },
          "technologies": {
            "minItems": 1,
            "type": "array",
            "items": {
              "type": "string",
              "minLength": 1
            }
          },
          "image": {
            "type": "string",
            "pattern": "^\\/images\\/projects\\/[a-z0-9-]+\\.webp$"
          },
          "imageSource": {
            "type": "string",
            "pattern": "^assets\\/[\\w .-]+\\.(png|jpe?g|webp|avif)$"
          },
          "imageAlt": {
            "type": "object",
            "properties": {
              "ru": {
                "type": "string",
                "minLength": 1
              },
              "en": {
                "type": "string",
                "minLength": 1
              }
            },
            "required": [
              "ru",
              "en"
            ],
            "additionalProperties": false
          },
          "accent": {
            "type": "string",
            "enum": [
              "blue",
              "mint",
              "lilac"
            ]
          },
          "demoUrl": {
            "anyOf": [
              {
                "type": "string",
                "format": "uri"
              },
              {
                "type": "null"
              }
            ]
          },
          "repositories": {
            "type": "array",
            "items": {
              "type": "object",
              "properties": {
                "label": {
                  "type": "string",
                  "minLength": 1
                },
                "url": {
                  "type": "string",
                  "format": "uri"
                }
              },
              "required": [
                "label",
                "url"
              ],
              "additionalProperties": false
            }
          }
        },
        "required": [
          "slug",
          "title",
          "status",
          "order",
          "featured",
          "category",
          "summary",
          "overview",
          "features",
          "decisions",
          "technologies",
          "image",
          "imageSource",
          "imageAlt",
          "accent",
          "demoUrl",
          "repositories"
        ],
        "additionalProperties": false
      }
    }
  },
  "required": [
    "version",
    "site",
    "profile",
    "copy",
    "skills",
    "experience",
    "projects"
  ],
  "additionalProperties": false
}
