{
  "$schema": "./portfolio.schema.json",
  "version": 1,
  "site": {
    "baseUrl": "https://coreytaz.github.io",
    "title": {
      "ru": "Степан Быков — Frontend React-разработчик",
      "en": "Stepan Bykov — Frontend React Developer"
    },
    "description": {
      "ru": "Портфолио Степана Быкова: React, TypeScript и Next.js. Проекты, технические решения, живые демо и исходный код.",
      "en": "Stepan Bykov’s frontend portfolio: React, TypeScript, and Next.js. Explore projects, technical decisions, live demos, and source code."
    }
  },
  "profile": {
    "name": {
      "ru": "Степан Быков",
      "en": "Stepan Bykov"
    },
    "role": {
      "ru": "Frontend React-разработчик",
      "en": "Frontend React Developer"
    },
    "intro": {
      "ru": "Я Степан Быков, frontend-разработчик. Работаю с React и TypeScript: от интерфейсов до приложений с API и real-time взаимодействием.",
      "en": "I’m Stepan Bykov, a frontend developer working with React and TypeScript — from interfaces to applications with APIs and real-time interactions."
    },
    "about": {
      "ru": "Мне интересно, как отдельные компоненты складываются в целый продукт. В моих проектах есть работа с состоянием, авторизацией, внешними данными и событиями в реальном времени. Помимо frontend, я использую NestJS и базы данных — это помогает видеть приложение целиком.",
      "en": "I’m interested in how individual components become a complete product. My projects explore state management, authentication, external data, and real-time events. I also use NestJS and databases, which helps me see the application as a whole."
    },
    "github": "https://github.com/Coreytaz",
    "email": null,
    "telegram": null,
    "resume": null
  },
  "copy": {
    "ru": {
      "skip": "Перейти к содержимому",
      "navWork": "Проекты",
      "navAbout": "Обо мне",
      "navContact": "Контакты",
      "navMenu": "Открыть меню",
      "navClose": "Закрыть меню",
      "theme": "Переключить тему",
      "language": "Switch to English",
      "home": "На главную",
      "heroEyebrow": "FRONTEND DEVELOPER / REACT & TYPESCRIPT",
      "heroLine1": "Логика внутри.",
      "heroLine2": "Простота",
      "heroLine3": "снаружи.",
      "viewWork": "Смотреть проекты",
      "github": "GitHub",
      "scroll": "Листайте — дальше интереснее",
      "indexLabel": "ПОРТФОЛИО",
      "workEyebrow": "01 / ИЗБРАННЫЕ РАБОТЫ",
      "workTitle": "От идеи до интерфейса.",
      "workIntro": "Три проекта. Разные задачи. Один подход — внимание к тому, как всё работает.",
      "caseStudy": "Разбор проекта",
      "liveDemo": "Открыть демо",
      "source": "Исходный код",
      "backend": "Серверная часть",
      "projectCount": "проекта в фокусе",
      "aboutEyebrow": "02 / ЗА ИНТЕРФЕЙСОМ",
      "aboutTitle": "Код — это только начало.",
      "aboutNote": "React, TypeScript и интерес к тому, что под капотом.",
      "skillsTitle": "Инструменты в контексте.",
      "skillsIntro": "Технологии, которые можно увидеть в моих проектах.",
      "relatedProjects": "Посмотреть в проекте",
      "contactEyebrow": "03 / ДАВАЙТЕ ЗНАКОМИТЬСЯ",
      "contactTitle": "Хорошие продукты\nначинаются с диалога.",
      "contactIntro": "Исходный код, проекты и профиль — на GitHub. Буду рад обсудить frontend и новые задачи.",
      "contactAction": "Перейти в GitHub",
      "email": "Написать на почту",
      "telegram": "Telegram",
      "resume": "Открыть резюме",
      "footerNote": "Сделано с React, TypeScript и вниманием к деталям.",
      "backTop": "Наверх",
      "print": "Версия для печати",
      "backWork": "Все проекты",
      "overview": "О проекте",
      "features": "Что внутри",
      "decisions": "Технические решения",
      "stack": "Стек проекта",
      "links": "Ссылки",
      "nextProject": "Следующий проект",
      "caseLabel": "РАЗБОР ПРОЕКТА",
      "notFoundTitle": "Кажется, мы свернули не туда.",
      "notFoundText": "Такой страницы нет. На главной есть проекты, которые стоит посмотреть.",
      "experienceTitle": "Опыт работы",
      "allProjects": "Другие проекты"
    },
    "en": {
      "skip": "Skip to content",
      "navWork": "Work",
      "navAbout": "About",
      "navContact": "Contact",
      "navMenu": "Open menu",
      "navClose": "Close menu",
      "theme": "Toggle theme",
      "language": "Переключить на русский",
      "home": "Back to home",
      "heroEyebrow": "FRONTEND DEVELOPER / REACT & TYPESCRIPT",
      "heroLine1": "Logic underneath.",
      "heroLine2": "Clarity on",
      "heroLine3": "the surface.",
      "viewWork": "Explore my work",
      "github": "GitHub",
      "scroll": "Scroll to explore",
      "indexLabel": "PORTFOLIO",
      "workEyebrow": "01 / SELECTED WORK",
      "workTitle": "From idea to interface.",
      "workIntro": "Three projects. Different challenges. A shared focus on how things work.",
      "caseStudy": "Explore the project",
      "liveDemo": "View live demo",
      "source": "Source code",
      "backend": "Backend",
      "projectCount": "projects in focus",
      "aboutEyebrow": "02 / BEHIND THE INTERFACE",
      "aboutTitle": "Code is just the beginning.",
      "aboutNote": "React, TypeScript, and curiosity about what happens underneath.",
      "skillsTitle": "Tools in context.",
      "skillsIntro": "Technologies you can explore in my projects.",
      "relatedProjects": "See it in a project",
      "contactEyebrow": "03 / LET’S CONNECT",
      "contactTitle": "Good products start\nwith a conversation.",
      "contactIntro": "Explore my source code, projects, and profile on GitHub. Happy to talk frontend and new challenges.",
      "contactAction": "Find me on GitHub",
      "email": "Send an email",
      "telegram": "Telegram",
      "resume": "View résumé",
      "footerNote": "Built with React, TypeScript, and attention to detail.",
      "backTop": "Back to top",
      "print": "Print this page",
      "backWork": "All projects",
      "overview": "Overview",
      "features": "Inside the project",
      "decisions": "Technical decisions",
      "stack": "Project stack",
      "links": "Links",
      "nextProject": "Next project",
      "caseLabel": "PROJECT NOTES",
      "notFoundTitle": "A little off the beaten path.",
      "notFoundText": "This page doesn’t exist. There are projects worth exploring on the home page.",
      "experienceTitle": "Experience",
      "allProjects": "More projects"
    }
  },
  "skills": [
    {
      "id": "interface",
      "title": {
        "ru": "Интерфейсы",
        "en": "Interfaces"
      },
      "description": {
        "ru": "Компоненты, маршрутизация и типизированная логика приложения.",
        "en": "Components, routing, and typed application logic."
      },
      "technologies": ["React", "Next.js", "TypeScript", "Sass"],
      "projects": ["animbook", "react-chat"]
    },
    {
      "id": "data",
      "title": {
        "ru": "Данные и состояние",
        "en": "Data & state"
      },
      "description": {
        "ru": "Запросы к API, клиентское состояние и обмен событиями.",
        "en": "API requests, client state, and event-driven communication."
      },
      "technologies": [
        "Redux Toolkit",
        "RTK Query",
        "TanStack Query",
        "Socket.IO"
      ],
      "projects": ["spacex-ships", "react-chat"]
    },
    {
      "id": "beyond",
      "title": {
        "ru": "За пределами frontend",
        "en": "Beyond the frontend"
      },
      "description": {
        "ru": "Серверная часть, хранение данных и авторизация.",
        "en": "Backends, data storage, and authentication."
      },
      "technologies": ["NestJS", "PostgreSQL", "MongoDB", "JWT"],
      "projects": ["animbook", "react-chat"]
    }
  ],
  "experience": [],
  "projects": [
    {
      "slug": "pizza-time",
      "title": "Pizza Time",
      "status": "draft",
      "order": 10,
      "featured": false,
      "category": {
        "ru": "Веб-интерфейс",
        "en": "Web interface"
      },
      "summary": {
        "ru": "Проект из предыдущей версии портфолио.",
        "en": "A project from the previous portfolio."
      },
      "overview": {
        "ru": "Сохранён в архиве до обновления внешнего демо и описания.",
        "en": "Archived until its external demo and description are updated."
      },
      "features": {
        "ru": [],
        "en": []
      },
      "decisions": {
        "ru": [],
        "en": []
      },
      "technologies": ["HTML", "CSS", "JavaScript", "jQuery"],
      "image": "/images/projects/pizza-time.webp",
      "imageAlt": {
        "ru": "Интерфейс Pizza Time",
        "en": "Pizza Time interface"
      },
      "accent": "blue",
      "demoUrl": null,
      "repositories": [
        {
          "label": "Frontend",
          "url": "https://github.com/Coreytaz/pizza"
        }
      ],
      "imageSource": "assets/pizza.png"
    },
    {
      "slug": "golden-property",
      "title": "Golden Property Solution",
      "status": "draft",
      "order": 11,
      "featured": false,
      "category": {
        "ru": "Веб-интерфейс",
        "en": "Web interface"
      },
      "summary": {
        "ru": "Проект из предыдущей версии портфолио.",
        "en": "A project from the previous portfolio."
      },
      "overview": {
        "ru": "Сохранён в архиве до обновления внешнего демо и описания.",
        "en": "Archived until its external demo and description are updated."
      },
      "features": {
        "ru": [],
        "en": []
      },
      "decisions": {
        "ru": [],
        "en": []
      },
      "technologies": ["HTML", "CSS", "JavaScript", "Gulp"],
      "image": "/images/projects/golden-property.webp",
      "imageAlt": {
        "ru": "Интерфейс Golden Property Solution",
        "en": "Golden Property Solution interface"
      },
      "accent": "blue",
      "demoUrl": null,
      "repositories": [],
      "imageSource": "assets/GoldenPropertySolution.png"
    },